{"conflict_policy":"highest-priority-then-plugin-id-byte-order","entries":[{"aliases":["打量"],"forbidden":false,"normalized_term":"凝视","note":"项目偏好，高优先级胜出","preferred":"端详","priority":30,"source_plugin_id":"com.plotpilot.lexicon.b","term":"凝视"},{"aliases":[],"forbidden":false,"normalized_term":"归途","note":"","preferred":"归途","priority":5,"source_plugin_id":"com.plotpilot.lexicon.a","term":"归途"},{"aliases":[],"forbidden":false,"normalized_term":"月色","note":"","preferred":"月光","priority":10,"source_plugin_id":"com.plotpilot.lexicon.b","term":"月色"},{"aliases":[],"forbidden":true,"normalized_term":"非常","note":"避免空泛程度副词","preferred":"避免使用","priority":20,"source_plugin_id":"com.plotpilot.lexicon.a","term":"非常"}],"lexicon_id":"merged:44b64889979377a915e320558dd70ada7b20d7b16598d596","normalization":"unicode-nfc-casefold-v1","schema":"lexicon/v1","version":"1.0.0"}